Product_Name,Total_Price,Price_Per_Unit,Unit_Value,Unit
"Vegan Organic Plant Protein Powder and Meal Replacement Shake With Shaker Cup and 2 Oz MCT Oil - By 310 Nutrition - Gluten, Dairy and Soy Free - 0g of Sugar | Keto and Paleo Friendly (Chocolate)",74.99,74.99,1.0,Count
"Charcurterie by Sergio ""The Grand"" acommpaniment collection",74.99,74.99,1.0,Count
"From You Flowers - Sweetheart Money Tree for Birthday, Anniversary, Get Well, Congratulations, Thank You, All Occasions",74.98,74.98,1.0,Count
"From You Flowers - Ladybug Chocolate-Covered Strawberries for Birthday, Anniversary, Get Well, Congratulations, Thank You, All Occasions",74.98,74.98,1.0,Count
"Dried Turkish Apricots by Its Delish, (10 lbs)",74.98,74.98,1.0,Count
From You Flowers - 1 Dozen Baby Boy Belgian Chocolate Covered Strawberries,74.98,74.98,1.0,Count
"De La Rosa Organic White Grape Juice, Kosher, Non-GMO & Gluten Free, No Preservatives or Sulfites, Vegan White Grape Juice, 25.4 Oz Glass Bottle (Pack of 6)",74.98,74.98,1.0,Count
"From You Flowers - Belgian Chocolate Covered Jalepenos - 1 Pound for Birthday, Anniversary, Get Well, Congratulations, Thank You, All Occasions",74.98,74.98,1.0,Count
"From You Flowers - Celebrate! Candy & Chocolate Treats Tray for Birthday, Anniversary, Get Well, Congratulations, Thank You, All Occasions",74.98,74.98,1.0,Count
"From You Flowers - SMILE Chocolate Covered Strawberries for Birthday, Anniversary, Get Well, Congratulations, Thank You, All Occasions",74.98,74.98,1.0,Count
"Taco Seasoning by Its Delish, (1 lb)",74.9,74.9,1.0,Count
Gold Medal Buttermilk Biscuit Mix 25 Pound,74.67,74.67,1.0,Count
"Burt's Bees 100% Natural Moisturizing Lip Crayon, Tahitian Sunset, 0.1 Ounce",7.46,74.6,0.1,ounce
"Tillamook Ice Cream, 3 Gallon Tub (White Chocolate Chip Raspberry)",74.49,74.49,1.0,Count
"Gift Basket Village Gourmet Charcuterie Meats and Cheeses Gift Box for Retirement (XL), Signature Meat & Cheddar Cheese with Summer Sausage, Salami, Cheese Spreads, Ideal for Corporate & Company Event",74.45,74.45,1.0,Count
Happy Birthday Orchard Delight Fruit and Gourmet Gift Basket,74.28,74.28,1.0,Count
A Gift Inside Congratulations Orchard Delight Fruit and Gourmet Basket,74.28,74.28,1.0,Count
"Benchmark Bouquets - Oriental Lilies & Red Roses (Glass Vase Included) - Fresh Flowers for Delivery - Gift for Graduation, Birthday, Anniversary, Sympathy, Get Well, Congratulations",74.11,74.11,1.0,Count
"Chef Paul Blackened Redfish Magic Seasoning Blends | Cajun-Style Spices & Seasonings | Gluten-Free, No MSG, Bold Flavor | Perfect for Grilling, Cooking & BBQ | 10 lb. Package (Pack of 1 case)",74.07,74.07,1.0,Count
Winexpert Iced Tea Twisted Mist 6l Wine Kit (Limited Release),73.99,73.99,1.0,Count
Thanks a Million Gift Box,73.98,73.98,1.0,Count
"La Rustichella - Truffle Olive Oil (16.91 fl oz (500 ml), White Truffle Olive Oil)",73.98,73.98,1.0,Fl Oz
Gift Basket Drop Shipping A Smile A Day Get Well Gift Box,73.8,73.8,1.0,Count
"KaBloom PRIME NEXT DAY DELIVERY - Mother’s Day Collection - Cupid's Roses Romantic Bouquet of 9 Red Roses and 9 Pink Roses With Vase.Gift for Birthday, Thank You, Valentine, Mother’s Day Fresh Flowers",73.58,73.575,1.0,Count
"LorAnn Orange Oil SS, Natural Flavor, 1 dram bottle (.0125 fl oz - 3.7ml - 1 teaspoon)",9.17,73.36,0.12,Fl Oz
"Food Gift Baskets, Thank You Gift Baskets For Women, Men, Mom, Dad, Friend, Co-worker and Office Gifting Gourmet Food Gifts By Dulcet Gift Baskets",72.99,72.99,1.0,Count
"Gift Baskets Food Gifts, Anniversary, Housewarming, Birthday Gift Baskets For Women, Men, Friends, Him, Her, Parents, & Family By Dulcet Gift Baskets",72.99,72.99,1.0,Count
"Gourmet Gift Baskets Thinking of You Food Gifts, Food Gift Baskets for Women, Men, Daughter, Dad, Son, Friends, Coworkers By Dulcet Gift Baskets",72.99,72.99,1.0,Count
"Mother's Day Food Gift Baskets Gourmet Gift Baskets Food Gifts For Women, Mom, Grandma, Sister or Wife Gourmet Food Gifts By Dulcet Gift Baskets",72.99,72.99,1.0,Count
"Dulcet Gift Baskets Classic Honey Confection Happy Fathers Day Tin of Gourmet Pastries Great Celebration Gift For Men, Boyfriend, Dad, Coworker, or Grandpa",72.99,72.99,1.0,Count
"White Chocolate Covered Macadamia Nuts by Its Delish, 5 lbs bulk Bag, White Milk Chocolate Coated Macadamia Nuts, Kosher Dairy",72.99,72.99,1.0,Count
"Thank You Gift Baskets, Gourmet Food Gifts, Thank You Gift Baskets For Women, Men, Coworkers, Corporate Clients and Office Gifting By Dulcet Gift Baskets",72.99,72.99,1.0,Count
"Dulcet Gift Baskets Holiday Party Tin Box, Sweet Treats, Snack Care Package, For Friends, Family, Boss, Employees and Gatherings",72.99,72.99,1.0,Count
"Thank You Gift Baskets For Women, Men, Family or Office Gatherings and Corporate Clients Gourmet Gift Baskets, Thank You Basket By Dulcet Gift Baskets",72.99,72.99,1.0,Count
"KIND ZERO Added Sugar Bars, Keto Snack, Peanut Butter Dark Chocolate, Good Source of Fiber, Gluten Free, Low Sugar, 5g Protein, 30 Count",72.91,72.91,1.0,Count
Blue Diamond Lightly Salted Almonds (Pack of 4),72.89,72.89,1.0,Count
"Carbonaut Gluten Free Granola, Cinnamon Apple Crumble | Keto-Certified & Non-GMO | Perfect Keto Granola For Cereal, Yogurt, or Snacking | Only 3g of Carbs Per Serving, 10 oz (Pack of 6)",72.84,72.84,1.0,Count
A Gift Inside Harvest Favorites Fruit and Gourmet Gift Box,72.65,72.65,1.0,Count
"L'Oréal Paris Colour Riche Lipstick, Wisteria Rose, 0.13 oz.",9.44,72.6154,0.13,Ounce
"Oasis 033879001 VersaFilter Replacement Filter, Bottle Filler Filter",72.6,72.6,1.0,Count
"Planters Deluxe Mixed Nut, 2.25 Ounce -- 72 per case.",163.09,72.4844,2.25,Ounce
"ABSOLUTELY GLUTEN FREE FLATBREAD GF TSTD ONION, 5.29 OZ, PK- 12",72.41,72.41,1.0,Count
"ABSOLUTELY GLUTEN FREE FLATBREAD GF TSTD ONION, 5.29 OZ, PK- 12",72.41,72.41,1.0,Count
"Raisin Nut Bran Oatmeal Crisp Breakfast Cereal, 19.7 oz (Pack of 6)",72.35,72.35,1.0,Count
"Sara Lee Hillshire Farms Cheddarwurst Skinless Smoked Sausage Link, 6 Pound -- 2 per case.",144.48,72.24,2.0,Count
Gift Basket Village Village Caffe Gift Basket,72.13,72.13,1.0,Count
"Just Popped | Gourmet Delicious Yellow Colored Movie Theater Butter Popcorn Bulk Party Bag Perfect Gifts Popcorn for Father Day, Birthday Parties, Weddings & Anniversary - (175 Cups Per Case)",72.07,72.07,1.0,Ounce
"LUCIEN GEORGELIN, Frt Spread, Og1, Strawberry, Pack of 6, Size 11.28 OZ, (Gluten Free Low Sodium Vegan Wheat Free Yeast Free 95%+ Organic)",72.03,72.03,1.0,Count
"Berri Lyte Advanced Plant Based Organic Electrolyte Solution – Pediatric Rehydration Drink – Natural Sugar Strawberry Flavor, 1 L, 6 ct",72.02,72.02,1.0,Fl Oz
"Maybelline SuperStay Matte Ink Liquid Lipstick, Dreamer, 0.17 fl. oz.",12.24,72.0,0.17,Fl Oz
"Yogurt Covered Papaya Dices by It's Delish, 10 Lbs Bulk | Kosher Dairy-Free Jumbo Yogurt Covered Fruit for Vegan Snacking | Dried Diced Papaya Coated in Yogurt-Flavored Shell Snack Treats",71.99,71.99,1.0,Count
"Sugar Free Dark Chocolate Covered Almonds by Its Delish, 5 lbs Bulk Kosher Parve and Vegan Semisweet Chocolate",71.99,71.99,1.0,Count
"Gourmet Toasted Unsalted Pecans by Its Delish, 5 lbs Bulk Bag – Oven Fresh Dry Roasted Pecan Nuts Halves Unsalted - Keto, Kosher",71.99,71.99,1.0,Count
"Purple Yogurt Covered Raisins by It's Delish, 10 lbs Bulk | Kosher Dairy-Free Yogurt Covered Fruit for Vegan Snacking | Dried Raisins Coated in Yogurt-Flavored Shell Snack Treats",71.99,71.99,1.0,Count
"Golden California Raisins by Its Delish, (10 lbs)",71.99,71.99,1.0,Count
"Cinnamon Flavored Toffee Covered Almonds by It's Delish, 10 lbs Bulk",71.99,71.99,1.0,Count
"SODA,GINGER BEER,GLASS",71.96,71.96,1.0,Count
Island Mist Black Raspberry Merlot Wine Kit by Winexpert by Southern Homebrew,71.95,71.95,1.0,Count
Island Mist Green Apple Riesling BONUS KIT Includes Labels,71.95,71.95,1.0,Count
"Musselman's Chunky Applesauce-Cane Sweetened, 104 oz., (Case of 3)",71.9,71.9,1.0,Count
"Sweet Street Key Lime Pie - 12 inch, 14 Slice - 4 per case.",287.37,71.8425,4.0,Count
Matcha Powered Green Tea,71.79,71.79,1.0,Ounce
"KaBloom Flowers - Mother's Day Collection - PREMIUM 50 Orange Tulips - Wholesale Fresh Flowers I Gift for Birthday, Sympathy, Anniversary, Get Well, Thank You, Valentine, Mother’s Day Fresh Flowers",71.67,71.67,1.0,Count
"GreatFoods Fresh Fruit and Snacks Premium Gift Tower, Fruit Gift Basket, Snack Gift Basket, Gourmet Food Gifts, Corporate Gifts",71.61,71.615,1.0,Count
Tonic-Klenz - Non-GMO Alkalizing & Energizing Complete Flush and Natural Cleanser,62.99,71.5795,0.88,Ounce
SoPakCo MRE Meals Ready To Eat Case Pack of 14 For Survival And Emergency,71.5,71.5,1.0,Count
OG2 WOOD TOMATO KETCHUP (12 X 19.5 OZ),71.49,71.49,1.0,Count
"Congratulations Food Gift Baskets for Women, Men, Mom, Dad, Son, Daughter, Siblings, Friends & CoWorkers Gourmet Food Gifts By Dulcet Gift Baskets",71.49,71.49,1.0,Count
Creme Savers Strawberries and Creme Hard Candy | The Taste of Fresh Strawberries Swirled in Rich Cream | The Original Classic Creme Savers Brought To You By Iconic Candy | 6.25oz Bag (12 Count),71.49,71.49,1.0,Count
Spring Cookies 24 Pack Party Favors flower butterfly bee Critters Decorated | INDIVIDUALLY WRAPPED Sugar Cookies | Gift Basket Peanut & Nut Free Bulk,71.35,71.35,1.0,Count
"Brew Glitter - Rose Gold (1x 4g Jar) | Edible Glitter for Drinks, Cocktails, Beer, Garnish & Beverages",9.98,71.2857,0.14,Ounce
Food For Life Baking Co. - Organic - Ezekiel 4-9 - Sprouted Whole Grain Crunchy Cereal - Original - 16 oz - case of 6 - Dairy Free - Yeast Free -Vegan,71.23,71.23,1.0,Count
Spicely Organic Bay Leaves California Whole 0.09 Ounce Jar Certified Gluten Free,10.66,71.0667,0.15,Ounce
"Viking Whole Grain Breaded Alaskan Pollock Stick, 5 Pound -- 2 per case.",142.02,71.0125,2.0,Count
Green Mountain Breakfast Blend Light Roast K Cups,70.9,70.9,1.0,Count
"BAKELL Edible Luster Dust & Paint | LUSTER DUST Edible Powder | KOSHER Certified Paint, Powder & Dust | 100% Edible & Food Grade| Cakes, Vegan Paint & Dust (Moonstone Black, 4g)",9.98,70.8156,0.14,Ounce
"Brew Glitter Edible Glitter For Drinks, Beer, &Cocktail Beverages - 1x 4g Flip Top Jar (Orange)",9.98,70.73,0.14,Ounce
Aqueon Strip Light Led,70.64,70.64,1.0,Count
"Smuckers Grape Jelly, 1/2 Ounce -- 200 per case.",35.11,70.22,0.5,Ounce
"WALKERS SHORTBREAD RND, 5.3 OZ, PK- 12",70.16,70.16,1.0,Count
"Alive and Kicking Par Baked Pizza Crust, 14 inch -- 12 per case.",81.78,70.0951,1.17,Foot
Christmas Gift Baskets,70.0,70.0,1.0,Count
"Birch & Meadow 1 Gallon of Cotton Candy Crunch, Ice Cream Topping, Dessert Topper",69.99,69.99,1.0,Count
"Happy Birthday Food Gifts, Gourmet Birthday Gift Baskets for Women, Mom, Dad, Him, Her, Teens, College Student, Co-workers By Dulcet Gift Baskets",69.99,69.99,1.0,Count
NY Spice Shop Chocolate Covered Espresso Beans - 3 Pound Cappuccino Roasted Espresso Beans Candy - Dark Chocolate Coffee Bean Snack - Espresso Candy Variety Pack - A Coffee Lover's Chocolate Delight,69.99,69.99,1.0,Count
Alder Creek Gift Baskets Sugar Free Chocolate Gift with Russell Stover Sugar Free Chocolate,69.99,69.99,1.0,Count
"Dulcet Gift Baskets Gourmet Chocolate Brownie Tin Brownie Assortment Delicious Cheesecake, Rocky Fudge, Chocolate Ganache, Brownies Fresh Healthy Ingredients Happy Holidays Gift",69.99,69.99,1.0,Count
"Gourmet Food Gift Baskets Congratulations Gift Baskets For Women, Men, Wife, Dad, Mom, College Students, and Friends Food Gifts By Dulcet Gift Baskets",69.99,69.99,1.0,Count
"Birthday Gift Baskets, Birthday Gifts For Sister, for Mom, Dad, College Student, Friends, Co-worker, Food Gifts By Dulcet Gift Baskets",69.99,69.99,1.0,Count
Light Blue Value Size Candy Buffet - (Approx. 7.3 lbs),69.99,69.99,1.0,Count
"Dulcet Gift Baskets Elegant Sprinkle Cookie-Chocolate Fudge Brownie Gourmet Bakery Gift Basket Great Gift for Birthdays, New Baby, Anniversaries- Mother’s Day.",69.99,69.99,1.0,Count
"Dulcet Gift Baskets Day Valentines Day Delightful, Lovely Cookie Gift Box Assortment with Traditional Black and White - Sprinkle Cookies, - Assorted Flavors for Valentine’s Day for Mom, Women, and Sisters.",69.99,69.99,1.0,Count
Purple Value Size Candy Buffet - (Approx. 7 lbs),69.99,69.99,1.0,Count
"Sugar Free White Jordan Almonds by Its Delish, 5 Lbs Bulk Bag | Candied Almond Nut with Hard Candy Coating | No Sugar Added | Bulk Wedding Favors and Party Buffets - Vegan & Kosher",69.99,69.99,1.0,Count
"Sri Lankan Vanilla Beans Whole Grade A Vanilla Pods for Homemade Vanilla Extract, Baking, Ice Cream, Flavoring, & Vanilla Powder (50 Pack)",69.99,69.99,1.0,Count
Pink Value Size Candy Buffet - (Approx. 7 lbs),69.99,69.99,1.0,Count
"Thank You Gift Baskets For Women, Men, Family, Friends or Office Gatherings and Corporate Clients Gourmet Gift Baskets, Thank You Basket By Dulcet Gift Baskets",69.99,69.99,1.0,Count
"Sympathy Gift Basket by Dulcet Gift Baskets - Sympathy Gift of Freshly Baked Goods Individually Wrapped - Whoopie Pies, Blueberry Muffins, and Cookies Assortment - Snack Box of Freshly Baked Goods",69.99,69.99,1.0,Count
Island Blue's 100% Jamaican Blue Mountain Coffee - Medium Roasted Blue Mountain Coffee from Jamaica - Ground (16oz),69.99,69.99,1.0,Count
"Gift Baskets Food Gifts, Congratulations Gift Baskets for Women, Men, Mom, Dad, Friends, Daughter, Sister, College Students & Corporates By Dulcet Gift Baskets",69.99,69.99,1.0,Count
"Alder Creek Gift Baskets Decadent Lindt Chocolate Gift Tower with Chocolate Truffles, Popcorn and more for Birthdays, Thank You, Holidays, Congratulations Gift",69.99,69.99,1.0,Count
"Dulcet Gift Basket Happy Valentines Baked Goods Gift Box ? Luxurious Gourmet Bakery Dessert Gift Tin Box with Whoopie Pies, Muffins, Cookies, Crumb Cake, Delicious Pastry for Girlfriend, Fianc?e, lover, or Partner.",69.99,69.99,1.0,Count
"Dulcet Gift Baskets Red Blue and White S Sprinkled Cookie and Fudge Brownie Patriotic Gift Box Great Gift for July 4, Labor Day, Independence Day, and Memorial Day present",69.99,69.99,1.0,Count
"Congratulations Food Gifts Gourmet Food Gift Baskets Women Men Family College Friends, Students or Office Gatherings Food Gifts By Dulcet Gift Baskets",69.99,69.99,1.0,Count
"Birthday Gift Baskets, Birthday Food Gifts For Men, Women, Mom, Dad, Him, Her, College Student, Teens, Friends, Gourmet Food Gifts By Dulcet Gift Baskets",69.99,69.99,1.0,Count
"Gourmet Food Gift Baskets, Thank You Gift Baskets for Women, Friend, College, Couples, Husband, Wife, Co-workers, Him & Her By Dulcet Gift Baskets",69.99,69.99,1.0,Count
From You Flowers - Birthday Cake Pops,69.98,69.98,1.0,Count
"From You Flowers - Chocolate Covered Ice Cream Cone Cake Pops for Birthday, Anniversary, Get Well, Congratulations, Thank You, All Occasions",69.98,69.98,1.0,Count
"From You Flowers - Belgian Chocolate Covered Pickles for Birthday, Anniversary, Get Well, Congratulations, Thank You, All Occasions",69.98,69.98,1.0,Count
"From You Flowers - Pretty Pink Rose Plant for Birthday, Anniversary, Get Well, Congratulations, Thank You, All Occasions",69.98,69.98,1.0,Count
"From You Flowers - Fancy Assorted Nuts in a Wood Tray for Birthday, Anniversary, Get Well, Congratulations, Thank You, All Occasions",69.98,69.98,1.0,Count
"Fun Snacks and Activity Basket for Boys - Makes a Perfect Birthday, Easter, Christmas or Any Occasion Gift for Kids.",69.97,69.97,1.0,count
"Roxy & Rich Fondust Powder Food Color (Neon Yellow, 4 Grams)",9.8,69.9643,0.14,Ounce
Hickory Farms Farmhouse and Signature Beef - Meat and Cheese Food Gift Basket (Large) - Box Set | Charcuterie Board Food | Summer Sausage | Father's Day | Mother's Day | Easter | Christmas | Holiday | Housewarming | Gourmet | Sympathy | Care Package,69.96,69.96,1.0,Count
Ultimate Moroccan Tagine Spices & Seasoning Kit,69.95,69.95,1.0,Count
"Old Fashioned Fresh Bakery Pastry Signature Gift Basket Features Whoopie Pies and Flaky Rugelah Great Gift Family, Friends, Him, Her & Office events By Dulcet Gift Baskets",69.95,69.95,1.0,Count
VineCo Niagara Mist Raspberry Dragon Fruit Wine Ingredient Kit,69.95,69.95,1.0,Count
"Cookies Gift Baskets, Thank You, Get Well, Sympathy Gift Baskets for Friends, Him, Her, Parents, & Family Gourmet Food Gifts By Dulcet Gift Baskets",69.95,69.95,1.0,Count
Nearly Natural 1353-PK Large Mixed Daisy Arrangement - Pink,69.88,69.885,1.0,Count
McCormick Pure Anise Extract 1 OZ (Pack of 18),69.88,69.88,1.0,Count
"Revlon Super Lustrous Lip Gloss, Pango Peach",9.06,69.6923,0.13,Fl Oz
"Neutrogena Healthy Skin Brightening Eye Perfector & Under Eye Concealer, Dark Circle Treatment Concealer Makeup with Soy & Vitamin E Antioxidant, Broad Spectrum SPF 25, Medium 15,.17 oz",11.82,69.5294,0.17,Ounce
Ghirardelli Choc Bkng Bar 70 Ex Bttrs,69.49,69.49,1.0,Count
"CUISINART Griddler Panini, 1 EA",69.47,69.47,1.0,Count
Taste Nirvana Real Thai Coffee - Latte - Case of 12 - 9.5 Fl oz.,69.41,69.41,1.0,Count
"McCormick Freeze-Dried Chives, 0.16 oz",11.1,69.375,0.16,Ounce
From You Flowers - Easter Belgian Chocolate Covered Strawberries and Breakable Bunnies,69.36,69.355,1.0,Count
MARSHMALLOWS by De La Rosa..Sweet Candy 10oz... mtc,69.31,69.31,1.0,Count
White Cranberry Pinot Gris Kit (Island Mist) by Island Mist,69.17,69.17,1.0,Count
Ap Products MER14TCQD1 High Pressure Hose W/144,69.11,69.11,1.0,Count
"Collins Amarena Cherries - Garnish, Cocktails, Desserts, Gluten Free and Vegan Italian Sweet Tart Sour Cherry, Perfect for Bars, Restaurant, Food Service, Bakery, Pastry Shop, 7 lb (3.18 kg) Set of 1",68.98,68.98,1.0,Count
Glutino Pretzels Sticks - Case of 12 - 14.1 oz.,68.97,68.97,1.0,count
"Rice Krispies Treats Marshmallow Snack Bars, Made with Whole Grain, Kids Snacks, Chocolatey Chip (80 Bars)",68.88,68.875,1.0,Count
"Colour Mill Pastel Pack Oil-Based Food Coloring, 20 Milliliters Each of 6 Colors: Baby Blue, Baby Pink, Lavender, Lemon, Mint and Peach",46.74,68.7426,0.68,Fl Oz
Mangrove Jack's US West Coast M44 Dry Yeast,27.48,68.7,0.4,Ounce
"Las Sevillanas Palanqueta Mixta – Peanut and Mixed Seeds Bar, Traditional Mexican Candy, Crunchy Snack Bar with Peanuts & Mixed Seeds - 31.74 Oz/900g (Pack of 1)",21.81,68.6929,0.32,Ounce
Stonewall Kitchen Down East Breakfast Gift (4 pc gift),68.45,68.45,1.0,Count
Jim's Organic Coffee - Whole Bean - Italian Roast - Case of 6 - 11 oz.,68.25,68.25,1.0,Count
"TAG Veranda Melamine Blate Set, 1 EA",67.99,67.99,1.0,Count
"Dulcet Gift Baskets Bakery Sampler Dessert Gift Basket Full of Fresh Baked Goodies Great Gift for Sympathy, Get Well, Birthday, Holidays/for Parents, Family, Him, Her, or BFF.",67.99,67.99,1.0,Count
From You Flowers - Sympathy Rose & Necklace Gift Set,67.98,67.98,1.0,Count
"Brew Glitter - Holiday Combo Packs (4g Jars) | Assorted Edible Drink Glitter for Festive Beer, Cocktails, Soft Drinks and Other Beverages (4, Halloween Colors - B)",37.98,67.8214,0.56,Ounce
"Just Popped | Gourmet Delicious Turquoise Colored Movie Theater Butter Popcorn Bulk Party Bag Perfect Gifts Popcorn for Father Day, Birthday Parties, Weddings & Anniversary - (175 Cups Per Case)",67.8,67.8,1.0,Ounce
"Luster Dust - Soft Rose Gold (4g 1x Jar) | Edible Vegan Dust & Paint for Cake Decorating, Ice Cream, Desserts, Cocktails and Beverages by Bakell",9.48,67.7143,0.14,Ounce
"Dell Alpe Sauce Tomatoe Basil, 25 Oz (Pack Of 6)",67.7,67.7,1.0,Count
"Good Host,Original, Iced Tea, 2.35kg/5.2lbs. {Imported from Canada}",67.64,67.64,1.0,Count
"Alive and Kicking Par Baked Pizza Crust, 16 inch -- 18 per case.",90.16,67.6217,1.33,Foot
TSAR CAVIAR Siberian Sturgeon Caviar 3.5 oz (100G) - OVERNIGHT DELIVERY - Black Caviar Sturgeon - Light-Salted Osetra Caviar Eggs - Gourmet Food Gifts - Malossol Fish Roe,236.25,67.5,3.5,Ounce
"From You Flowers - Patriotic Belgian Chocolate Covered Strawberries for Birthday, Anniversary, Get Well, Congratulations, Thank You, All Occasions",67.48,67.48,1.0,Count
"From You Flowers - Rainbow Chocolate Covered Strawberries for Birthday, Anniversary, Get Well, Congratulations, Thank You, All Occasions",67.48,67.48,1.0,Count
"Panda Express Kung Pao Stir Fry Sauce, 18.75 OZ (Pack of 8)",67.43,67.43,1.0,Count
"NESCAFE Espresso Whole Bean Coffee, 100% Arabica, Medium Roast Coffee, 2.2 Lb Bag, Box of 6 Bags",404.47,67.4117,6.0,Count
"Pennant Foods Ready to Sheet Puff Pastry Dough, 15 Pound - 2 per case.",134.07,67.035,2.0,Count
"LorAnn Maple SS flavor, 16 ounce bottle",67.0,67.0,1.0,Fl Oz
"Garden Deluxe Vegetable Soup Mix by It’s Delish, 5 Lbs Bulk Bag | 16 Natural Dehydrated Vegetables for Ramen Noodles, Soup Greens with Beets | Freeze Dried Veggie Blend, No MSG, Vegan, Kosher",66.99,66.99,1.0,Count
"Domino Light Brown Sugar, 25 Pound Bag -- 1 each.",66.99,66.99,1.0,Count
"Entryways Williamsburg Doormat - Dash Away All, 22""x35""",66.99,66.99,1.0,Count
"Coolbreeze Beverages Fountain Machine Syrup, Beverage Concentrate Mix or Home Use- 2.5 Gal Bag in Box - Sweet Tea",66.99,66.99,1.0,Count
"Primal Kitchen Sauce Pizza Red Unsweetnd, 1 Lb (Pack Of 6)",66.99,66.99,1.0,Ounce
"Sugar Free Dark Chocolate Covered Peanuts by Its Delish, 5 lbs Bulk Kosher Parve and Vegan Semisweet Chocolate",66.99,66.99,1.0,Count
"Dehydrated Mango Slices by Its Delish, (10 lbs)",66.99,66.99,1.0,Count
"Delight Expressions® ""You are Eggstra Especial"" Easter Gift Basket for Girls - Premade Gift Basket for Kids",66.95,66.95,1.0,Count
Cleanstream Bardex Style Inflatable Double Bulb Enema System,66.95,66.95,1.0,Count
"KaBloom Flowers -Valentine's Day Collection - 30 Purple Tulips, Gift for Birthday, Sympathy, Anniversary, Get Well, Thank You, Valentine, Mother’s Day Fresh Flowers",66.95,66.95,1.0,Count
"KaBloom Flowers -Valentine's Day Collection - 30 Red Tulips, Gift for Birthday, Sympathy, Anniversary, Get Well, Thank You, Valentine, Mother’s Day Fresh Flowers",66.95,66.95,1.0,Count
"Otis Spunkmeyer Delicious Essentials Variety Muffin, 2.25 Ounce -- 96 per case.",150.21,66.7578,2.25,Ounce
"Frontier Co-op Nutmeg Whole, Certified Organic, Fair Trade Certified, Kosher | 1 lb. Bulk Bag | Myristica fragrans",66.56,66.56,1.0,Count
Summer Cookies Beach Party Pool Favors Individually Wrapped Sun Theme Popsicle themed | 24 Pack Bulk for Kids Birthday Party Sugar Cookie,66.48,66.48,1.0,Count
"Cadbury Milk Tray, 360 g",23.92,66.4444,0.36,kg
"Benchmark Bouquets - Signature Roses & Alstroemeria (Glass Vase Included) - Fresh Flowers for Delivery - Gift for Graduation, Birthday, Anniversary, Sympathy, Get Well, Congratulations",66.42,66.42,1.0,Count
"Schar Bread 10 Grain Artisan, 14.08 Oz (Pack Of 8)",66.36,66.36,1.0,Count
Gift Basket Drop Shipping 820152 Youre a Superstar Movie Gift Box,66.25,66.25,1.0,Count
Eden Brothers Sunflower Seeds - Orange Sun,10.58,66.125,0.16,Ounce
"Maybelline New York The City Mini Palette, Rooftop Bronzes, 0.14 Ounce",9.24,66.0,0.14,Ounce
Craft a Brew Home Merlot Making Kit – Easy Beginners with Ingredients and Supplies – Ultimate Wine Brewing,65.99,65.99,1.0,Count
"Gourmet Food Gift Baskets Congratulations Gift Baskets For Women, Men, Mom, Dad, College Students, and Friends Food Gifts By Dulcet Gift Baskets",65.99,65.99,1.0,Count
Candy Retailer Candy Bleeps Tangy Fruit Flavored Coated Candy Balls (10 Pounds),65.99,65.99,1.0,Count
Dulcet Gift Basket - Freshly Baked Scones Individually Wrapped -Food Gift Basket of Different Flavored Scones - Perfect Snack Box for All Occassions - Customizable Personal Note Option Available,65.99,65.99,1.0,Count
"Whole Dill Seeds by Its Delish, bulk (10 lbs)",65.99,65.99,1.0,Count
"Gourmet Food Gifts, Thank You Gift Basket, Appreciation, Thank You Gift Baskets For Women, Men, Mom, Dad, Siblings, Friends & Co-workers By Dulcet Gift Baskets",65.99,65.99,1.0,Count
"Bloomingmore | Hot Pink Alstroemeria Peruvian Lilies | 50 Stems | Floral Arrangements | Home, Office, Wedding Decor, DIY, Party Event, Housewarming, Teacher and Engagement",65.98,65.98,1.0,Count
"Bloomingmore | Floral Arrangements | Assorted Alstroemeria Peruvian Lilies | 50 Stems | Home, Office, Wedding Decor, DIY, Party Event, Housewarming, Teacher and Engagement",65.98,65.98,1.0,Count
Orchard Breezin' Sangria with Seville Orange Wine Kit by RJS,65.95,65.95,1.0,Count
"L'Oréal Paris Colour Riche Lipstick, Caramel Latte, 0.13 oz.",8.56,65.8077,0.13,Ounce
"China Beauty Rings Tea (Loose) (8 oz, ZIN: 510605)",526.32,65.79,8.0,Ounce
"Veggie-Go's, Berry Spinach Fruit Rolls, 0.42 oz",27.55,65.5952,0.42,Ounce
"READYWISE - Simple Kitchen, Broccoli Cheese Soup Mix, 17 Servings Per Pack, MRE, Gluten Free, & Vegetarian, Hiking, Camping Essentials, Food, Soup Mix, for Events, Emergency Food Supply, or Daily Use, Pack of 4",65.47,65.475,1.0,Ounce
"KaBloom Flowers - Mother's Day Collection - 30 Assorted Tulips, Gift for Birthday, Sympathy, Anniversary, Get Well, Thank You, Valentine, Mother’s Day Fresh Flowers",65.22,65.22,1.0,Count
LAKE BEET CAR ORNG (6 X 32 OZ),65.19,65.195,1.0,Count
Royal Amber Osetra Caviar - Russian Sturgeon Roe - Cru Dynasty (1 ounce (28 grams)),65.0,65.0,1.0,Ounce
Prada Candy Ladies EDP Spray 1.7 oz,110.5,65.0,1.7,Fl Oz
"Caviar Star - Pacific White Sturgeon Caviar | Exquisite Fresh Fish Roe Seafood Delicacy for Gourmet Dining | Ideal for Elegant Entertaining, and Blinis for Caviar (7 oz)",454.99,64.9986,7.0,Ounce
SC55 Pop Corn Cardboard Cutout Standup,64.99,64.99,1.0,Count
Alstertor Dusseldorf Style Mustard - Case of 12 - 8.45 oz.,64.99,64.99,1.0,Count
Simply Organic Ground Black Pepper - Case of 6 - 4 oz.,64.99,64.99,1.0,Count
"Executive Suite 100% Colombian Decaffeinated Coffee, 2 Oz., Box Of 42",64.99,64.99,1.0,Count
"Premium California Roasted Salted Shelled Pistachio Kernels by Its Delish - 2.5 LBS Reusable Jumbo Container (Jar) Bulk Style, Fresh & Crunchy Dry Roasted Pistachio Nuts No Shell with Salt, Kosher Snack & Salad Topping",64.99,64.99,1.0,Count
Buffalo Bills 12-Piece Beef Jerky Sampler Black 6-Pack Gift Cooler (12 assorted 1.5oz jerky packs),64.99,64.99,1.0,Count
Movie Night Popcorn and Candy Gift Basket - Keto Cravings Gift Basket - Perfect for a Cozy and Fun Evening at Home or the Theater with Family and Friends (Keto Cravings Family with Blanket),64.99,64.99,1.0,Ounce
